rank,title,hot_value,datetime
1,坚持打铁必须自身硬,7908871,2025-01-10 18:05:42
2,教育局回应4年级数学期末试卷太难,7999965,2025-01-10 18:05:42
3,女生确诊渐冻症一年容貌巨变,7860077,2025-01-10 18:05:42
4,瞄准全方位扩大内需持续发力,7766478,2025-01-10 18:05:42
5,沈腾马丽春晚第二次联排,7646373,2025-01-10 18:05:42
6,留几手 我把我的爱人也弄丢了,7528723,2025-01-10 18:05:42
7,18岁小伙嚼槟榔8年脸方成电视机,7458076,2025-01-10 18:05:42
8,《国色芳华》李现超绝松弛感,7390957,2025-01-10 18:05:42
9,央行暂停买入国债意味着什么,7214019,2025-01-10 18:05:42
10,华妃一睁眼天塌了,7157565,2025-01-10 18:05:42
11,加州州长给拜登打了5个电话没打通,7041247,2025-01-10 18:05:42
12,72岁“霸总”爷爷走红,6958171,2025-01-10 18:05:42
13,海口一老年公寓虐待老人？编的,6844986,2025-01-10 18:05:42
14,全球超1亿台智能手机出自川渝,6740408,2025-01-10 18:05:42
15,夫妻俩顿顿吃腌菜先后确诊胃癌,6655494,2025-01-10 18:05:42
16,公安部回应境外电信网络诈骗问题,6570489,2025-01-10 18:05:42
17,17种身体异常一般不用治疗,6417129,2025-01-10 18:05:42
18,中居正广承认性侵,6349355,2025-01-10 18:05:42
19,鸿蒙原生版微信上架,6296816,2025-01-10 18:05:42
20,鲁GT8586你真帅,6109161,2025-01-10 18:05:42
21,路遇遛狗不拴绳怎么办,6072690,2025-01-10 18:05:42
22,留几手不想看葛夕的日记,5936502,2025-01-10 18:05:42
23,是语文出了轨还是数学劈了腿,5839882,2025-01-10 18:05:42
24,茅台冰淇淋闭店停产三折清仓,5739576,2025-01-10 18:05:42
25,大爷为游客垫医药费被拉黑 官方回应,5601557,2025-01-10 18:05:42
26,出国留学是通敌叛国?人民日报发声,5562674,2025-01-10 18:05:42
27,男子年终聚会被同事抱摔意外离世,5496953,2025-01-10 18:05:42
28,男子狱中苦读24年获博士学位,5303259,2025-01-10 18:05:42
29,黑神话销售额90亿,5218148,2025-01-10 18:05:42
30,你本来可以不得甲型流感,5194007,2025-01-10 18:05:42
31,男子10岁时烫伤疤痕60多年后癌变,5006268,2025-01-10 18:05:42
32,腾讯给员工发巨型甘蔗,4912592,2025-01-10 18:05:42
33,金价一年创40次新高 金店却扛不住了,4847929,2025-01-10 18:05:42
34,说了20分钟对方不上当骗子气到大叫,4771548,2025-01-10 18:05:42
35,酸奶箱内藏4.8万现金 跑腿小哥报警,4688696,2025-01-10 18:05:42
36,韩国人来旅游 上海豪车全上街了,4523356,2025-01-10 18:05:42
37,22岁大学生将行李箱寄回家后失踪,4471564,2025-01-10 18:05:42
38,男子被同事抱摔离世 两人获刑,4347248,2025-01-10 18:05:42
39,杨紫也闯进了人妻赛道,4272413,2025-01-10 18:05:42
40,接触了艾滋病毒72小时能自救,4110392,2025-01-10 18:05:42
41,阿Sa蔡卓妍回应阿娇身材争议,4095207,2025-01-10 18:05:42
42,若开军：缅甸政府军空袭致约40死,3915633,2025-01-10 18:05:42
43,蝙蝠侠目睹2050万美元豪宅被烧光,3865647,2025-01-10 18:05:42
44,00后现役女军人荣立二等功,3774852,2025-01-10 18:05:42
45,24岁女生干咳两个月查出肺癌,3624195,2025-01-10 18:05:42
46,以为养胃其实伤胃的4个习惯,3576638,2025-01-10 18:05:42
47,爸爸抱着女儿转着转着就长大了,3418925,2025-01-10 18:05:42
48,女生放寒假进自家工厂“打螺丝”,3354000,2025-01-10 18:05:42
49,女子为赚带工费把蛇藏进内衣,3220168,2025-01-10 18:05:42
50,感染甲流后小腿肚子疼需高度重视,3184469,2025-01-10 18:05:42
51,市委书记喊话执法部门释放善意,3100000,2025-01-10 18:05:42
